{
  "schema_version": 1,
  "task_id": "11111111-1111-4111-8111-111111111111",
  "device_id": "22222222-2222-4222-8222-222222222222",
  "action_id": "33333333-3333-4333-8333-333333333333",
  "observation_id": "44444444-4444-4444-8444-444444444444",
  "lease_id": "55555555-5555-4555-8555-555555555555",
  "epoch": 0,
  "sequence": 1,
  "action": { "kind": "click", "x": 420, "y": 510, "button": "left" }
}
